resilientSolutionsID;Name;Description;references
SPTK29;Clustering Protocols;Clustering protocols can be used agonist to railures and attacks. The Pertectly anonymous data aggregation protocol p[92] can be used in IoT Application. Clusterng and data aggregation in wireless sensor networks improves scalability, and helps the efficient use of scarce resources. Yet, these mechanisms also introduce some security issues. In particular, aggregator nodes become attractive targets of physical destruction and jamming attacks. In order to mitigate this problem, [p92] propose a new private aggregator node election protocol that hides the identity of the elected aggregator nodes both from external eavesdroppers and from compromised nodes participating in the protocol. p[92] also propose a private data aggregation protocol and a corresponding private query protocol which allows the aggregators to collect sensor readings and respond to queries of the base station, respectively, without revealing any useful information about their identity to external eavesdroppers and to compromised nodes. Others Clustering protocols are discussed in p[5l] and can be applied in IoT applications;P51,P92
SPTK30;Risk Assessment;It is fundamental tor the continuing security of the system, by discovering new threats, applying Updates and patches to the firmware on the system devices, as well as providing improvements in the existing security structure. Risk Assessment: b) Finding New Threats, c) Applying Updates d) Applying Patches, e) Providing Improvements and Upgrading Systems.;P60
SPTK31;Securing the Premises;Securing the premises is perhaps the most important security feature that IoT needs, as it physically secures the IoT devices, i.e. sensor nodes, computers, firewalls, data servers, etc. The security of the loT devices is achieved by using Physical Barriers to block any unauthorized people, Intrusion Detection systems to monitor any strange benavior, Access Control to make sure only legible users enters the premises of the IoT and even Security personnel to ensure total security of the IoT devices. Securing the IoT Premises: a) Physical Barriers b) Intrusion Detection Alarms c)Monitoring Devices d)Access Control Devices e)Securty Personnel;P60
SPTK32;IEEE Standards Solutions;The IEEE provides standard mechanisms for the physical (PHY) and medium access control (MAC) layers which are useul in implementation ot a smart city. There exist three families that can provide low-power and short-range IoT operation for a smart city [7]. IEEE 802.15.4: Important characteristics include real-time quality by guarantying time slots, collision dodging through CSMA/CA and merged assistance for secure communication. Moreove, the devices include power management functions, for example energy detection and link quality. IEEE 802.15.1 is used in Bluetooth. IEEE 802.15.11 This technology is provided from WiFi Alliance, a trade association in control of the certifying products if they adjust to particular standards of interpretability. The WiFi Protected Access (WPA) [56] is a security protocol that has become the regulation for providing security .11 networks. Here by using an already shared encryption key (PSK) or digital certificates, the WPA algorithm Temporal Key Integnty Protocol (TKIP) encrypts information providing authentication to the particular networks. The WPA algorithm (TKIP) further improved upon to the new WPA2 [57] [56] that utilizes more securer encryption algorithm that is Advanced Encryption Standard (AES). Moreover this protocol also uses better and advanced kev distribution techniques., which help in improved session security to avoid eavesdropping;P111
SPTK33;Tag Blocking, Tag Sleeping and Selective Blocking;It is important to discuss various techniques and strategies that may play part in better security performance of RFID in a smart city. Privacy protection is an important need and right of the citizens and as discussed previously, that tag killing may play role in privacy protection but this also may lead to loss data permanently. A better option is tag sleeping When the tag does not need to to be read, it is put to sleep temporarily [45]. There is another concept of tag blocking and selective blocking [40].;P111
SPTK34;Re-encryption and Minimalist Cryptography;Privacy protection is an important need and right of the citizens and as discussed previously, that tag killing may play role in privacy protection but this also may lead to loss data pemanently. Other techniques include re-labeling approach, re-encryption and minimalist cryptography [45];P111
SPTK35;Data Coding and Multiple Re-Transmission;The interterence problems in the RFID system can be dealt by data coding, multiple re transmission and data integnty check.;P111
SPTK36;Hash Lock and Hash Link;Hash-Lock and Hash Link techniques are also important as they provide better authentication. There are other authentication techniques based on hash such as ID exchange and distributed RFID challenge/answer authentication [39];P111
DRTK1;Preventive Measures;It is an Availability and Resilience Perspective tactic of IoT-A. The choice Preventive measure (DC A.15) is aimed at preventing disastrous events, like data-loss, from occurring. To achieve this, data is replicated to have identical copies in reserve in case the original data gets lost. Consistency among the data replicas needs to be assured by the design. To minimize risks the replicas are better stored at different locations that the original data, preferably in the cloud.;P87
DRTK2;Detective Measures;It is a Availability and Resilience Perspective tactic of IoT-A. "Detective measures (DC A.16) aim at detecting or discovering unwanted events by monitoring indicators for unwanted events, like measured values that exceed a certain range. This strategy requires an Information Model of those unwanted events together with their indicators that are used to detect the unwanted event. The event detection should be operated independent of the subsystem that is monitored to make sure the unwanted events can be detected.;P87
DRTK3;Corrective Measures;It is an Availability and Resilience Perspective tactic of IoT-A. The design choice "Corrective measures (DC A.17) is aimed at corecting or restoring systems after disastrous events have occured. Assuming the previous two choices have been implemented, meaning the preventive methods have been applied and the disastrous event has been detected corectly, the system can be restored to working order again. Backups of system configurations that have worked corectly before are restored. A configuration history provides the functionality needed for restoring working configurations. The system corection process needs to be operated independently of the system to be restored.;IoT-A
DRTK4;Business Continuity Plan (BCP);Applyinga Business Continuity Plan meta-model is a way to ensure the ability to operate in spite of unforeseen events and to quickly recover from any type of business interuption. A BCP meta-model formalizes essential aspects and concepts of Business Continuity Management in a socio-technical system. The BCP meta-model is generic enough to be applied to any healthcare organization and Iot Application.;P84
DRTK5;Backup Strategies;A good backup strategy is the best defense against data loss. A backup strategy or backup policy is essentially a set of procedures that you prepare and implement to protect your important digital content from hard drive failures, virus attacks and other events or disasters. Features of a Good Backup Strategy are: a) Able to recover from data loss in all circumstances like hard drive failure, virus attacks, theft, accidental deletes or data entry erors, sabotage, fire, flood, earth quakes and other natural disasters. b) Able to recover to an earlier state if necessary like due to data entry errors or accidental deletes. c) Able to recover as quickly as possible with minimum effort, cost and data loss. d) Require minimum ongoing human interaction and maintenance after the initial setup. Hence able to run automated or semi-automated. Planning Your Backup Strategy: 1) What to Backup. 2) Where to Backup to, 3) When to Backup, 4) Backup Types, 5) Compression and Encryption, 6) Testing your backup and 7) Backup utilities and services.;P85,P86
SCTK1;Dynamic Configuration;Dynamic system reconfigurability can be achieved with replacing the application software or alter its configuration on-the-fly. One method to replace an application from live mote is to utilize dynamic linking and loading to change required application modules. Traditionally most of the configuration of the application is hardcoded to the application binary image, which must be replaced if a configuration change is desired. Replacement of the binary image is costly operation in terms of resource use. If application logic is separated from the configuration it is easier to replace only needed parts of the configuration to change behavior of the application, if the desired change in behavior is small enough so the old application logic can handle the new behavior too. Replacing configuration is also cheaper operation in tems of resource use than replacement of whole binary image. Support for dynamic changes on the system configuration is required so the system can be adjusted for new conditions. Reconfigurable system is also the starting point for development of self-managing system that can adjust its operation automatically in response to changes in its environment.;P1
SCTK2;LEACH;The use of Wireless Sensor Networks (WSNs) is anticipated to bring enomous changes in data gathering, processing and dissemination for different environments and applications. However, a WSN is a power constrained system, since nodes nun on limited power batteries which shorten its lifespan. Prolonging the network lifetime depends on efticient management of sensing node energy resource. Hierarchical routing protocols are best known in regad to energy efficiency. By using a clustering technique hierarchical routing protocols greatly minimize energy consumed in collecting and disseminating data. Low Energy Adaptive Clustering Hierarchy (LEACH) is one of the fundamental protocols in this class. The [p78] proposed Advanced LEACH (A-LEACH), a heterogeneous-energy protocol to decrease probability of failure nodes and to prolong the time interval before the death of the first node (we refer to as stability period) and increasing the lifetime in heterogeneous WSNs, which is crucial for many applications such as ToT applications.;P78
SCTK3;Dynamic Modulation Scaling;Dynamic modulation scaling (DMS) is a dynamic reconfiguration technique at node-level reconfiguration used to reconfigure modulation schemes in communication to achieve energy efficiency in WSN. DMS has been utilized to reduce energy consum ption in wireless communication, where the communication energy was reduced by changing the modulation level of the communication at the cost of increased transmission time. Significant research and development efforts have been made on the scheduling algorithm for DMS to provide significant energy savings while maintaining the time constraints. The [p79] explain some DMS techniques that can be used in loT application.;P79
SCTK4;Dynamic Voltage Scaling (DVS);Dynamic Voltage Scaling (DVS) Is a dynamic reconfiguration technique at node-level reconfiguration used to reconfigure voltages and operating frequency of processors to achieve energy efficiency in WSN. The utilization of DVS technique required consideration of time constraints because the changes in operating frequency interfered with the computation time given a fixed computation workload. Hence, a scheduling algorithm was usually accompanied with DVS technique to guarantee the time constraint, especially in real-time applications. Researchers have worked on scheduling algorithms for using DVS in different applications. The p[79] explain some DVS techniques that can be used in loT a pplication.;P79
SCTK5;Adaptative Sampling Rate;Adaptive Sampling Rate Is a dynamic reconfiguration technique at node-level reconfiguration used to change the sampling rate of sensors to achieve energy efficiency in WSN.;P80
SCTK6;Intelligent Node Activation; Intelligent Node Activation is a dynamic reconfiguration technique at network-level reconfiguration used to change sensor node status to achieve energy efficiency in WSN. Intelligent node activation determines node activity to minimize redundant energy usage within the network. It involved redundant deployment of sensor nodes to allow a sensor node to go into sleep mode without degrading network performance. This reduced the overall energy consumption of the network by taking redundant nodes off line and scheduling active/sleep states of the sensor nodes.;P79,P81
SHTK1;SHA Based on MAPE-k loop;Fault tolerance is essential in the IoT. The number of vulnerable systems and attacks will increase, so there is a need to develop intrusion detection and prevention systems to protect the components of the IoT. The growth of connected devices in IoT makes the human intervention less effective. Autonomic computing aims to reduce the human intervention in complex systems, like the human nervous system controls autonomically some functions of body, like the digestive system. The proposed architecture defines five components, distributed between the monitoring phase, analysis phase and knowledge component, to add the property of self-healing into the Internet of Things. The Dendritic Cell Algorithm (DCA) is combined with an Artificial Intelligence component to allow the DCA learning the role of each Infomation sensed. The architecture described in this paper can implement a self-healing system in IoT nodes distributing roles between them in order to ease design of self-healing systems for IoT. Below we can see SELF-HEALING ARCHITECTURE based on MAPE-K loop that can be used in IoT application. More details in [p9];P9
SHTK2;SHõWA;The complexity of systems is considered an obstacle to the progress of the IT industry. Autonomic computing is presented as the altemative to cope with the growing complexity. It is a holistic approach, in which the systems are able to configure, heal, optimize, and protect by themselves. Web-based applications are an example of systems where the complexity is high. The number of components, their interoperability, and workload variations are factors that may lead to perfomance failures or unavailability scenarios. The occurrence of these scenarios affects the revenue and reputation of businesses that rely on these types of applications. The [p12] presented a self-healing framework for Web-based applications (SH6WA). SH3WA is composed by several modules, which monitor the application, analyze the data to detect and pinpoint anomalies, and execute recovery actions autonomously. The monitoring is done by a small aspect-oriented programming agent. This agent does not require changes to the application source code and includes adaptive and selective algorithms to regulate the level of monitoring. The anomalies are detected and pinpointed by means of statistical corelation. The data analysis detects changes in the server response time and analyzes if those changes are corelated with the workload or are due to a perfomance anomaly. In the presence of perfomance anomalies, the data analysis pinpoints the anomaly. Upon the pinpointing of anomalies, SH3WA executes a recovery procedure. Below we can see the Building blocks of the SHôWA framework that can be used in IoT application. More details in [p12].;P12
SHTK3;ACOSHR;Recent advances in Compact and wireless embedded Systems coupled wvith the technological innovations in Micro Electro Mechanical Systems(MEMS), Wireless Communications and networks paved the way for the development of small, resource constrained devices called Sensor Nodes (SNs). Perfomance of Sensor Node is highly dependent on the effective and efficient usage of the available limited resources with it, leading to maximum lifetime of Wireless Sensor Network (WSN) which is a primary concem of wSNs. The depletion of a SN energy leads to change in topology of WSNs often over a period of time. Therefore, protocols which consider the dynamic nature of WSNs are crucial for improving the netwok lifetime. The [p13] proposed bio inspired Ant Colony optimization based Self healing routing scheme inspired by swam Intelligence technique to improve lifetime of a WSN. ACOSHR finds path by launching a colony of artificial ants that move through wireless links between source and destination. ACOSHR detemines path by considering both the remaining energy in the nodes and shorter lengths using the hop distance. Thus, ACOSHR maximizes the lifetime of the WSN. Below we can see the Flow chart for ACOSHR that can be used in IoT application More details in [p13];P13
SHTK4;Classical Counter Measures for Self Healing;Security solutions have been classified as either self-protecting or self-healing, in relation to the autonomic mechanism used for mitigation. Self-protecting solutions follow a passive approach and attempt to prevent security threats before they happen. This is done using various cryptographic techniques, with the knowledge of how common attacks are executed. In the case of self-healing solutions, the specific counter- measures for mitigation are taken only after the attack has been detected. Reactive measures are easier to achieve than protective measures, as typically the attacks aim confidentiality, integrity, availability, authenticity or privacy. Nevertheless, it is important to incude protective mechanisms as well supplementing the reactive mechanisms, resulting in what we call as hvbrid schemes. In [p15] is presented countemeasures.;P15
SHTK5;DEEJAM;Jamming is a very effective denial-of-service attack that renders most higher-layer secunty mechanisms mootyet it is often ignored in WSN design. The [p19] showed that an intemupt jamming attack is simple to perpetrate in software using a MICAzmote, is energy efficient and stealthy for the jammer, and completely disrupts communication. Thus, [p19] presented DEEJAM, a novel MAC-layer protocol for defeating stealthy jammers with IEEE 802.15.4-based hardware, to address this problematic area. It layers four defensivemechanisms to hide communication from a jammer, evade its search, and reduce its impact. DEEJAM defeated the other-wise devastating intemupt jammer, and achieves a packet delivery ratio of 88% in the presence ofa pulse jammer. More details in [p19];P19
SHTK6;Puzzle Schemes;Denial-of-service (DoS) attacks are on the ise in recent years and many cryptographic cient puzzle schemes have been proposed for mitigating such attacks. Nonetheless, these schemes lack a strategy for setting the puzzle difficulty parameter which is an important issue for the legitimate users as they should not be unfairly delayed during low server loads. The [p32]. proposed a leaky bucket rate limiting queue mechanism to set the puzzle difficulty according to a queue delay. This mechanism will rate limit the number of incoming requests to prevent server overloading. As a result, DoS attackers have to spend more time to solve harder puzzles which reduces their rate of attack success. More details in [p32];P32